<?xml version="1.0" encoding="UTF-8"?>
<!--
To change this template, choose Tools | Templates
and open the template in the editor.
-->


<template
    xmlns:xsi='http://www.w3.org/2001/XMLSchema-instance'
    xmlns='http://it-branch.com/xml/ns/template.xsd'
    xsi:schemaLocation='http://it-branch.com/xml/ns/template.xsd file:/var/www/azfcms/library/Azf/Template/template.xsd'>
    <name>Green Tree</name>
    <description>Green theme template</description>
    <identifier>greenTree</identifier>
    <regions>
        <region>
            <name>Header</name>
            <identifier>header</identifier>
        </region>
        <region>
            <name>Left</name>
            <identifier>left</identifier>
        </region>
    </regions>

</template>
