<?xml version="1.0" encoding="UTF-8"?>
<!--
To change this template, choose Tools | Templates
and open the template in the editor.
-->


<template
    xmlns:xsi='http://www.w3.org/2001/XMLSchema-instance'
    xmlns='http://it-branch.com/xml/ns/template.xsd'
    xsi:schemaLocation='http://it-branch.com/xml/ns/template.xsd file:/var/www/azfcms/library/Azf/Template/template.xsd'>
    <name>Demo Template</name>
    <description>Demo Template used for testing</description>
    <identifier>demo</identifier>
    <regions>
        <region>
            <name>Demo 1</name>
            <identifier>demo1</identifier>
        </region>
        <region>
            <name>Demo 2</name>
            <identifier>demo2</identifier>
        </region>
    </regions>

</template>
