<?xml version="1.0" encoding="UTF-8"?>
<!--
To change this template, choose Tools | Templates
and open the template in the editor.
-->


<template
    xmlns:xsi='http://www.w3.org/2001/XMLSchema-instance'
    xmlns='http://it-branch.com/xml/ns/template.xsd'
    xsi:schemaLocation='http://it-branch.com/xml/ns/template.xsd file:/var/www/azfcms/library/Azf/Template/template.xsd'>
    <name>Valid Template</name>
    <description>Valid Template Description</description>
    <identifier>validTemplate</identifier>
    <regions>
        <region>
            <identifier>header</identifier>
            <name>Header Region</name>
        </region>
    </regions>

</template>
